问题分类,Task,数量,问题名称,问题描述,UID,版本,系统,日期,进度,图片链接1,图片链接2,图片链接3
KTV,,1,无送礼评论按钮,please check out this problem I m so irritated just becoz of it ...I m unable to send ...gifts someone and I can't text them also ...becoz their is no options to send gifts or commenting something please check this and help me to suggest something about this problem I checked it ..on my Settings display ... settings also bt it doesn't work i got no benefit ? please help otherwise I will have to left this app ...from today becoz .I m totally gonna mad ?? to facing these problems!!So irritating;,"5629499491543980	",7.3.3,Android 8.1.0,2019/4/12 3:44,,https://improxy.starmakerstudios.com/tools/im/0/production/promotion/other/e8e9ab6780a3c163a6304c1bfe991a8e.jpg,https://improxy.starmakerstudios.com/tools/im/0/production/promotion/other/ea25fa6b58c8e8d5b92c8d9c7c819a67.jpg,
KTV,,1,无送礼评论按钮,I cant make a comment nor send a gifts;,"3637173033	",7.3.3,Android 9,2019/4/11 14:11,,https://improxy.starmakerstudios.com/tools/im/0/production/promotion/other/a5b92c7d5730b8dc03d702933d085c53.jpg,https://improxy.starmakerstudios.com/tools/im/0/production/promotion/other/26d5dfeb68e8ac5737ab2c3c844d6ba8.jpg,
作品/发布,T40750,1,上传歌曲消失,"Sir ,My profile Cover of song still from 01.04.19 it's not show progress of my song cover .It show only in moments.but not shown in Cover of song profile. please Solve The matter.;VijoyNigam ;Please send to me massage my following e mail address ;nigam.vijay5@gmail.com;Mobile No.9827207631.;","4785074599565379	",7.3.3,Android 8.0.0,2019/4/11 4:30,,https://improxy.starmakerstudios.com/tools/im/0/production/promotion/other/67b4f8e68ddf2ad68e305ff930b6809c.jpg,,
作品/发布,T40750,1,上传歌曲消失,Many of my recent covers have disappeared from my profile page. ;,"5066549355724647	",7.3.3,Android 9,2019/4/11 3:53,,,,
H5,,1,H5报错,"Pls respond..... ;    I am still trying to open a Party room and I still do not have any other options to do so.. My acct have been locked or frozen in some areas, i.e. videos, recordings, and song selections... Pls assist me in recovering this acct to its maximum use... Thanks ;","4785074601985080	",7.3.2,Android 6.0,2019/4/11 2:21,,https://improxy.starmakerstudios.com/tools/im/0/production/promotion/other/8b2296633a74958fef2f4a66885b7275.jpg,https://improxy.starmakerstudios.com/tools/im/0/production/promotion/other/fa5755b380d406038e06fa41883d97d6.jpg,https://improxy.starmakerstudios.com/tools/im/0/production/promotion/other/3733e4f49de1a2fd218f8ccfe7677959.jpg
